Comment,Platform,Untested,category,name,url,description,author,submissionDate,repo,featured,language,authorUrl
,Web,2 Stars,sdkLibraries,Node.js Client Library,https://www.npmjs.com/package/pollinationsai,"A TypeScript/Node.js client for accessing Pollinations AI services including image generation, text processing, and speech synthesis. Features full TypeScript typings, dual CJS/ESM module support, 100% test coverage and feed/streams support, builder pattern API and axios-based HTTP client implementation.",@fqueis,3/14/2025,https://github.com/fqueis/pollinationsai,,,
weird to have pollinations.ai again on github,,Untested,sdkLibraries,pollinations NPM Module,https://www.npmjs.com/package/pollinations,A Node.js package for accessing all Pollinations features.,@maxencexz,,,,,
in russian,Telegram,Untested,sdkLibraries,pypollinations,https://pypi.org/project/pypollinations/,Comprehensive Python wrapper for Pollinations AI API.,@KTS-o7,,,,,
,Web,Buggy,sdkLibraries,ComfyUI-Pollinations,https://github.com/1038lab/ComfyUI-Pollinations,"A custom node for ComfyUI that utilizes the Pollinations API to generate images and text based on user prompts, supporting multiple image and text generation models.",https://github.com/1038lab/,3/4/2025,https://github.com/1038lab/ComfyUI-Pollinations,,,
category?,Tool,Untested,sdkLibraries,pollinations_ai,https://pub.dev/packages/pollinations_ai,"A Flutter/Dart SDK package for accessing all features of pollinations.ai including text generation, image generation, audio, and listing all supported models.",@Meenapintu,3/31/2025,https://github.com/yehigo/pollinations.ai,,,
,Web,3 Stars,tutorials,🆕 Pollinations.AI AI/Teens talk,https://www.youtube.com/live/5Rvdfr2qYGA?si=i5NLOKI49fGxNAEK&t=1034,"Session 2: ai/teens worldwide conference exploring the forces shaping AI today, diving into governance, virtual connections, and decision-making with voices from multiple European cities.",@thomash_pollinations,4/15/2025,,TRUE,,
,Web,2 Stars,tutorials,Artistic Styles Book,https://proyectodescartes.org/iCartesiLibri/materiales_didacticos/Libro_Estilos/index.html,An interactive book showcasing 90+ artistic styles.,Juan Gmo. Rivera,,,,,
,Web,2 Stars,tutorials,Chinese DeepSeek Tutorial,https://linux.do/t/topic/447840/235,A tutorial showing how to make DeepSeek AI support image generation by leveraging Pollinations.ai's API.,https://linux.do/u/isinry,3/4/2025,,,,
,Web,1 Star,tutorials,Proyecto Descartes,https://proyectodescartes.org/revista/Numeros/Revista_8_2024/index.html,Educational initiative integrating Pollinations AI into STEM.,Juan Gmo. Rivera,,,,,
,Web,1 Star,tutorials,Tutorial,https://guiadehospedagem.com.br/pollinations-ai/,An in-depth Portuguese tutorial on using Pollinations AI.,Janderson de Sales,,,,,
,Web,Buggy,tutorials,Apple Shortcuts Guide,https://www.youtube.com/watch?v=-bS41VTzh_s,Video guide on creating AI images using Apple Shortcuts.,RoutineHub,,,,,
