Comment,Platform,Untested,category,name,url,description,author,submissionDate,repo,featured,language,authorUrl
,Roblox,3 Stars,llmIntegrations,🆕 FoodAnaly,https://foodanaly.vercel.app/,"An AI application for food analysis that uses advanced artificial intelligence technology to help users understand food ingredients, nutritional value, and health impacts.",liukang0120@163.com,4/23/2025,,TRUE,,
,Web,3 Stars,llmIntegrations,Pollinations Chat,https://websim.ai/@AdrianoDev1/pollinations-ai-assistant/4,"Pollinations' integrated AI for text and images, totally free and unlimited.",@adrianoprogramer,,,TRUE,,
lots of stars,Tool,3 Stars,llmIntegrations,LobeChat,https://lobehub.com/plugins/pollinations-drawing,"An open-source, modern-design ChatGPT/LLMs UI/Framework with speech-synthesis, multi-modal, and extensible plugin system.",,,https://github.com/lobehub/lobe-chat,TRUE,,
sdk lib ?,Web,3 Stars,llmIntegrations,DynaSpark AI,https://dynaspark.onrender.com,A versatile AI assistant with advanced image and text generation capabilities.,Th3-C0der,,https://github.com/Th3-C0der,TRUE,,
,Discord,3 Stars,llmIntegrations,Zelos AI image generator,https://websim.ai/@ISWEARIAMNOTADDICTEDTOPILLOW/ai-image-prompt-generator,"It uses Pollinations for both prompt enhancing and image generation, it was a easy to make project due to pollinations services being easy to use.",https://www.roblox.com/users/4361935306/profile,2/17/2025,,TRUE,,
,"iOS, Android",3 Stars,llmIntegrations,IMyself AI 🇨🇳,https://openai.lmyself.top/,"我们提供高质量的AI生成服务，包括图像生成、文本生成、音频生成和语音转文本服务， 让您轻松创建各种创意内容。 (We provide high-quality AI generation services, including image generation, text generation, audio generation, and speech to text services, allowing you to easily create various creative content.)",Shadownc,3/27/2025,,TRUE,zh-CN,
,Discord,3 Stars,llmIntegrations,🆕 DreamBig - Generative AI Playground,https://dreambiglabs.vercel.app/,"Interactive AI playground with chat, image generation, and voice responses for creative exploration.",@opzzxsprinta._999,4/15/2025,,TRUE,,
,Web,2 Stars,llmIntegrations,MiReXa AI,https://mirexa.vercel.app,"A state-of-the-art chatbot integrating multiple LLMs with advanced features including audio generation, image generation, mathematical proficiency, and real-time web search.",@withthatway,2/7/2025,,,,
,Web,1 Star,llmIntegrations,🆕 🤖 DesmondBot,https://cities-tomato-strong-peoples.trycloudflare.com/,"A snarky bot based on Llama that is 100% free, powered by the Pollinations text API and OpenWebUI. Other models are available as well.",@mcgdj,4/18/2025,,,,
,Android,Untested,llmIntegrations,🆕 Aura Chat bot,,A chat bot integrating Pollinations API for text and image generation.,@Py-Phoenix-PJS,4/26/2025,,,,
,,Untested,llmIntegrations,FlowGPT,https://flowgpt.com/p/instant-image-generation-with-chatgpt-and-pollinationsai,Generate images on-demand with ChatGPT!,,,,,,
,,Untested,llmIntegrations,gpt4free,https://github.com/xtekky/gpt4free,The official gpt4free repository - various collection of powerful language models.,xtekky,,,,,
,,Untested,llmIntegrations,Unity AI Lab,https://blog.unityailab.com/unity.html,"A specialized uncensored LLM model built on Mistral Large, focused on unrestricted conversations.",,,,,,
,,Untested,llmIntegrations,PrivatePollenAI,https://mmojocoder.github.io/PrivatePollenAI/chat.html,"A privacy-focused chat assistant app that securely stores data locally, integrates with PollinationAI for text and image generation, features a minimalistic UI, and allows users to choose models and write their own system instructions.",https://github.com/MMojoCoder,2/23/2025,https://github.com/MMojoCoder/PrivatePollenAI,,,
,Android,Untested,llmIntegrations,AI Unlimited Customizable Feature Module 🇨🇳,https://getquicker.net/Sharedaction?code=9ac738ed-a4b2-4ded-933c-08dd5f710a8b&fromMyShare=true,"This project provides a free API interface supporting various text and image generation models, including OpenAI's GPT-4, Gemini 2.0, etc. Users can access these models without an API key to perform text generation, image generation, translation, text polishing, and more.",https://linux.do/u/s_s/summary,3/10/2025,,,zh-CN,
,,,llmIntegrations,🆕 OkeyAI,https://chat.okeymeta.com.ng,"An LLM created by Africans to understand and have cultural awareness of African contexts and languages, OkeyAI outperforms many LLM models based on size and intelligence, OkeyMeta uses pollination image generating API to train it's LLM (OkeyAI) on images in real time.",@okeymeta,4/19/2025,https://github.com/okeymeta,,,
,Ableton Live,3 Stars,creativeApps,🎵 PolliSonic Generator,https://interzone.art.br/pollisonic_generator/,An AI-driven tool that transforms text prompts using MidiJourney into MIDI-based melodies through browser oscillators.,@brain.diver,,https://github.com/rafabez/pollisonic_generator,TRUE,,
,Web,3 Stars,creativeApps,Rangrez AI,https://rangrezai.com,"A web platform for inspiring, creating, and customizing designs.",@saadaryf,,,TRUE,,
,Web,3 Stars,creativeApps,UR Imagine & Chat AI,https://perchance.org/ur-imagine-ai,A free and limitless image generator with companion AI chat/roleplay system.,withthatway,,,TRUE,,
lots of stars,Tool,3 Stars,creativeApps,AI-Bloom,https://ai-bloom.vercel.app/,A minimal creative showcase of AI-powered content generation.,@diepdo1810,,,TRUE,,
,Web,3 Stars,creativeApps,AvatarStudio,https://astudio-dcae4.web.app,A system for creating custom characters that uses the Pollinations API for totally free and unlimited image generation.,@nic-wq,3/10/2025,,TRUE,,
,Web,3 Stars,creativeApps,RoastMaster AI,https://roastmaster-ai.vercel.app/,"An AI-powered roast generator that allows users to upload selfies for savage AI-generated roasts, enter text for brutal critiques, or engage in roast battles. Images are processed securely on the device, protecting user privacy.",@sugamdeol,3/14/2025,,TRUE,,
name?,Discord,3 Stars,creativeApps,roastmyselfie.app,https://roastmyselfie.app,AI Personality Analyzer - Get roasted and psychoanalyzed.. just from one selfie! Dare to try?,@andres_11,3/14/2025,,TRUE,,
,Web,3 Stars,creativeApps,Case Me 🇧🇷,,O projeto consiste em uma vending machine que criará capinhas para celular personalizadas com fotos ou outras imagens e cores de escolha do cliente final. (A vending machine that creates customized phone cases with photos or other images and colors chosen by the end customer.),anaboxmania@gmail.com,3/19/2025,,TRUE,pt-BR,
,Web,3 Stars,creativeApps,Pollinations.ai Image Generation (for Frame),https://github.com/CitizenOneX/frame_pollinations,"A Flutter application that listens for image generation prompts, requests images from Pollinations.AI, and displays them on the Frame wearable device. Users can use voice commands to generate images and save/share them using the device's sharing mechanism.",CitizenOneX,4/13/2025,https://github.com/CitizenOneX/frame_pollinations,TRUE,,
,Web,3 Stars,creativeApps,🆕 🌱 Strain Navigator,https://www.strainnavigator.com/,"A collection of tools to help Growers, Breeders & Seed Bankers. Free & Open Source powered by Pollinations.ai.",@Tolerable,4/15/2025,https://github.com/Tolerable/strainnavigator,TRUE,,
,Web,3 Stars,creativeApps,🆕 Generator Text AI 🇮🇩,https://app.ariftirtana.my.id/,"Generator Teks AI canggih dengan berbagai model AI seperti OpenAI, Llama, Mistral, dan DeepSeek. Hasilkan jawaban instan, dukung mode gelap/fokus, riwayat percakapan, dan contoh pertanyaan acak. Alat sempurna untuk kreativitas dan produktivitas. (Advanced AI Text Generator with various AI models like OpenAI, Llama, Mistral, and DeepSeek. Generate instant answers, support dark/focus mode, conversation history, and random question examples. Perfect tool for creativity and productivity.)",@ayick13,4/16/2025,https://github.com/ayick13/app,TRUE,id-ID,
,Web,2 Stars,creativeApps,StoryWeaver,https://devpost.com/software/storyweaver-013xdw,Crafts personalized picture books for children.,Multiple Authors,,,,,
,Web,2 Stars,creativeApps,POLLIPAPER,https://github.com/Tolerable/POLLIPAPER,A dynamic wallpaper app that uses Pollinations AI.,@intolerant0ne,,,,,
,Web,2 Stars,creativeApps,AI Image Generator,https://fvai.infinityfreeapp.com/my-apps/pollicb09.html,"A web-based AI image generator powered by Pollinations.ai, featuring multi-model support, customizable parameters, and real-time preview.",@hrisjeui,2/15/2025,https://github.com/hrisjeui/Multi-text-image-model-pollinations,,,
,Web,2 Stars,creativeApps,PromptPix (Android),https://expo.dev/accounts/aminmusah/projects/image-generator/builds/ed32c5d0-83c0-416b-889f-e36b997dd706,"An AI-powered image generation platform for Android designed to create stunning visuals from text prompts. Features dynamic image generation as users scroll, save to gallery, favorites, and a user-friendly interface.",https://discord.com/channels/@taylorsnupe,3/12/2025,https://github.com/AminMusah/ai-image-generator,,,
,Roblox,2 Stars,creativeApps,CalcuBite AI,https://calcubite.vercel.app/,"CalcuBite AI is a smart tool that analyzes food from images to provide calorie and nutrient details. Just take a photo, and it quickly gives you an estimate of your meal's nutritional value. It uses AI for accurate analysis, and if you run out of free scans, you can watch an ad to get more!",@sugamdeol,3/15/2025,,,,
,Web,2 Stars,creativeApps,PixPax,https://pixpal.chat,"A user-friendly chatbot that lets you analyze images, remix existing images or create new images, all through simple chat.",@andreas_11,3/17/2025,,,,
,Web,2 Stars,creativeApps,🆕 Generator AI Image 🇮🇩,https://kenthir.my.id/advanced-generator/,"Advanced AI Image Generator adalah platform inovatif yang memungkinkan Anda membuat gambar digital menakjubkan dengan kecerdasan buatan by pollinations.ai. Dengan dukungan berbagai model AI canggih seperti DALL·E 3, Stable Diffusion, dan Flux-Default. (An innovative platform that allows you to create amazing digital images with artificial intelligence powered by pollinations.ai. Supports various advanced AI models like DALL-E 3, Stable Diffusion, and Flux-Default.)",@kenthirai,4/15/2025,,,id-ID,
,Web,1 Star,creativeApps,Deep Saga,https://play.google.com/store/apps/details?id=com.cestrian.deepsaga.android&pcampaignid=pollinations,A text based RPG available on Android with AI-generated scene images.,@jr_7_77,,,,,
need an api key to use the text api,Web,1 Star,creativeApps,[AI] Character RP (Roblox),https://www.roblox.com/games/108463136689847/AI-Character-RP,A popular Roblox game for AI character roleplay.,[user113](https://www.roblox.com/users/5810708209),,,TRUE,,
,Web,1 Star,creativeApps,Sirius Cybernetics Elevator Challenge,https://sirius-cybernetics.pollinations.ai/,A Hitchhiker's Guide to the Galaxy themed LLM-based elevator game.,@thomash_pollinations,,https://github.com/voodoohop/sirius-cybernetics-elevator-challenge,,,
,Web,1 Star,creativeApps,AI PPT Maker,https://sites.google.com/view/kushai,Create AI-powered presentations using Pollinations' API.,@k_ush,,,,,
,"Web, NSFW",1 Star,creativeApps,Herramientas IA,https://proyectodescartes.org/descartescms/herramientas-ia,"Tools designed with Pollinations.AI and the DescartesJS editor, including tools from other Pollinations.AI community members.",@juanrivera126,3/10/2025,,,,
,Web,1 Star,creativeApps,StoryMagic: Interactive Kids Stories,https://storyai-wizard.vercel.app,"An interactive web application designed to create engaging and customizable stories for children. Users can generate creative narratives with personalized settings, characters, and themes. The project leverages AI to enhance storytelling with text generation, dynamic visuals, and interactive features.",@_dr_misterio_,3/14/2025,,,,
,Web,1 Star,creativeApps,Riffle,https://riffle.ink,"A powerful tool designed to make reading English books more enjoyable and effective while helping you build your vocabulary naturally. Using Pollinations AI to create content that incorporates your own vocabulary words allows you to learn them in a vivid, engaging context.",gsx123@gmail.com,3/28/2025,,,,
,Web,1 Star,creativeApps,Elixpo Art,https://elixpoart.vercel.app,"A Web interface to create thematic images from prompts, with multiple aspect ratios and also image reference inputs.",Ayushman Bhattacharya,3/31/2025,https://github.com/Circuit-Overtime/elixpo_ai_chapter,,,
,Tool,Untested,creativeApps,MIDIjourney,https://github.com/korus-labs/MIDIjourney,An AI-powered plugin for Ableton Live that turns text descriptions into music.,KORUS Labs,,,,,
,Tool,Untested,creativeApps,Infinite Tales,https://infinite-tales-rpg.vercel.app/,"A Choose Your Own Adventure RPG, dynamically narrated by AI.",JayJayBinks,,https://github.com/JayJayBinks/infinite-tales-rpg,,,
,Tool,Untested,creativeApps,StorySight,https://github.com/abiral-manandhar/storySight,An app to help children with learning disabilities.,,,,,,
lots of stars,Tool,Untested,creativeApps,Pollinations Gallery,https://deng-xian-sheng.github.io/pollinations-img-page/,A clean and simple gallery showcasing community's AI-generated images.,@deng-xian-sheng,,,,,
,Tool,Untested,creativeApps,image1gen,https://image1gen.streamlit.app/,Website to easily create images via pollinations.ai API.,@oopshnik,2/22/2025,https://github.com/oopshnik/image1gen,,,
,Web,Buggy,creativeApps,Musify - AI Enhanced Music Streaming,https://musify-sd.vercel.app/,"Musify is your AI-powered music buddy, making your jam sessions smarter and more fun. It is powered by pollinations api, it offers a slick and intuitive music experience with features like AI Music Assistant, Voice Commands, AI Playlist Creator, and Responsive Design.",@Sugamdeol,2/27/2025,,,,
,"Tool, Web",Buggy,creativeApps,AI儿童故事 🇨🇳,https://kidss.netlify.app/,"基于此项目 构建有趣的孩子故事书应用演示 (Based on this project, build an interesting children's storybook application demo)",MZ,3/10/2025,,,zh-CN,
,,Untested,creativeApps,Jenny AI,https://jenny-two.vercel.app/,Jenny AI is an AI chatbot and character creation platform with tts and sst it also has image generation and vision ability which are powered by pollinations.,https://www.linkedin.com/in/pritam-roy-95185328a,3/16/2025,,,,
,Tool,Untested,creativeApps,Podcast #1500,https://open.spotify.com/show/1wu4ngb1dclyTwoNN4cZzK,"Podcast project powered by pollinations, featuring dialogues among LLMs. First episode features 3o-mini and DeepSeek R1 70B talking about Vibe Coding.",@brain.diver,3/31/2025,,,,
,Tool,Untested,creativeApps,LAHGen,https://image.aixboost.com/,"An advanced AI-driven text-to-image generation platform designed to provide users with high-quality and realistic AI-generated images based on textual prompts. The platform allows users to generate unlimited AI images for free, leveraging cutting-edge AI models to produce stunning visual outputs in various artistic styles.",working7816@gmail.com,3/31/2025,,,,
,,Untested,creativeApps,🆕 MalaysiaPrompt 🇲🇾,https://malaysiaprompt.rf.gd/,"A free and fun platform for creating unique AI-generated images. No fancy skills needed – just your ideas and a few clicks to bring them to life. Features image generation, text-to-prompt conversion, and image-to-text capabilities.",@enciksnow,4/15/2025,,,ms-MY,https://x.com/enciksnow
,,,creativeApps,🆕 BlackWave,https://blackwave.studio/,"An AI image generator that creates unique images from text prompts. Fast, easy and free!",@metimol,4/19/2025,,,,
,,,creativeApps,🆕 RuangRiung AI Image 🇮🇩,https://ruangriung.my.id,"RuangRiung AI Image Generator ideal untuk seniman digital, desainer, atau siapa pun yang ingin mengeksplorasi kreativitas dengan bantuan AI. Tersedia dalam bahasa Inggris dan Indonesia, website ini menggabungkan fungsionalitas lengkap dengan desain yang elegan dan responsif. (RuangRiung AI Image Generator is ideal for digital artists, designers, or anyone who wants to explore creativity with AI assistance. Available in English and Indonesian, this website combines complete functionality with an elegant and responsive design.)",@ruangriung,4/20/2025,https://github.com/ruangriung,,id-ID,
,,,creativeApps,🆕 ImageGen AI Image,https://imagegen.narendradwivedi.org,A web application that utilizes Pollinations.AI API to generate images based on user-defined descriptions with features like prompt enhancement customizable image settings and image download.,https://www.linkedin.com/in/narendradwivedi,4/22/2025,,,,
,Web,3 Stars,toolsInterfaces,🆕 Echo AI,https://3ch0ai.github.io/EchoAI,"An HTML-based chat interface that leverages Pollinations AI as its core engine for both text and image generation, featuring user authentication, streaming responses, and plan management.",@3ch0AI,4/28/2025,https://github.com/3ch0AI/EchoAI,TRUE,,
,Web,3 Stars,toolsInterfaces,🆕 Pollinations.ai Enhancer,https://greasyfork.org/en/scripts/534183-pollinations-ai-enhancer,"Enhances the user experience on pollinations.ai pages by improving content readability, adding convenient download options, and providing easy access to generation metadata.",@fisven,4/27/2025,https://github.com/fisventurous/pollinationsai-enhancer,TRUE,,
,Web,3 Stars,toolsInterfaces,🆕 Pollinations.DIY,https://pollinations.diy,"A browser-based coding environment based on bolt.diy, featuring integrated Pollinations AI services, visual code editing, and project management tools.",@thomash_pollinations,,https://github.com/pollinations/pollinations.diy,TRUE,,
,Web,3 Stars,toolsInterfaces,Pal Chat,https://apps.apple.com/us/app/pal-chat-ai-chat-client/id6447545085?platform=iphone,An iOS app that integrates with all LLMs including Pollinations AI models in one unified simple interface.,https://x.com/pallavmac,,,TRUE,,
,Web,3 Stars,toolsInterfaces,Pollinator Android App,https://github.com/g-aggarwal/Pollinator,An open-source Android app for text-to-image generation.,@gaurav_87680,,,TRUE,,
,Web,3 Stars,toolsInterfaces,Elixpo-Art,https://elixpoart.vercel.app,A web interface for easy image generation with theme selection.,Ayushman Bhattacharya,,,TRUE,,
,Web,3 Stars,toolsInterfaces,Elixpo Art Chrome Extension,https://chromewebstore.google.com/detail/elixpo-art-select-text-an/hcjdeknbbbllfllddkbacfgehddpnhdh,It uses the pollinations image endpoint to generate an image with `boltning` as the model in 4 types of aspect ratios and themes with prompt engineering thus transforming selected texts into art smoothly with a disposable GUI in web.,Ayushman Bhatacharya,3/14/2025,https://github.com/Circuit-Overtime/elixpo_ai_chapter/tree/main/Elixpo%20Chrome%20%20Extension,TRUE,,
,"iOS, Android",3 Stars,toolsInterfaces,VibeCoder,https://vibecoderbyaashir.netlify.app/,"A web app for coding with vibes, created using Pollinations.AI Open Source API without coding syntax.",@Aashir__Shaikh,3/25/2025,,TRUE,,https://x.com/Aashir__Shaikh
,Web,3 Stars,toolsInterfaces,Imagen,https://altkriz.github.io/imagen/,"A beautiful web interface for generating images using Pollinations.ai API with only the ""flux"" and ""turbo"" models.",@altkriz,4/13/2025,https://github.com/altkriz/imagen,TRUE,,
,Web,3 Stars,toolsInterfaces,🆕 B&W SVG Generator,https://fluxsvggenerator.streamlit.app/,Uses Flux (through pollinations) and potrace to create B&W Vector files,@pointsguy118,4/15/2025,,TRUE,,
,Web,2 Stars,toolsInterfaces,Image Gen - Uncensored Edition,https://huggingface.co/chat/assistant/66fccce0c0fafc94ab557ef2,A powerful image generation assistant on HuggingChat.,@DeFactOfficial,,,,,
,Web,1 Star,toolsInterfaces,JustBuildThings,https://justbuildthings.com,"A collection of AI tools for image generation, character chat, and writing.",rasit,,,,,
,Web,1 Star,toolsInterfaces,🆕 NetSim,https://netsim.us.to/,websim.ai clone that's actually good,@kennet678,4/15/2025,,,,
,Android,Untested,toolsInterfaces,Own-AI,https://own-ai.pages.dev/,An AI text-to-image generator.,Sujal Goswami,,,,,
,,Untested,toolsInterfaces,Free AI Chatbot & Image Generator,https://freeaichat.app,A mobile app for unlimited AI chat and image generation.,@andreas_11,,,,,
,,Untested,toolsInterfaces,JCode Website Builder,https://jcode-ai-website-bulder.netlify.app/,A website generator using Pollinations text API.,@rtxpower,,,,,
,,Untested,toolsInterfaces,Server Status Dashboards,https://www.ai-ministries.com/serverstatus.html,Real-time monitoring dashboards for Pollinations text and image servers.,@tolerantone,,,,,
,,Untested,toolsInterfaces,Websim,https://websim.ai/c/bXsmNE96e3op5rtUS,A web simulation tool that integrates Pollinations.ai.,@thomash,,,,,
,Telegram,Buggy,toolsInterfaces,Anime AI Generation,https://www.animeaigeneration.com/,Create professional-quality anime characters with powerful AI technology. No artistic skills required.,@shreyas281898,2/11/2025,,,,
,Web,Buggy,toolsInterfaces,Pollinations.ai Model Comparison,https://endemicmedia.github.io/FLARE/llm-comparison-tool/,An interactive tool designed to compare outputs from various large language models with customizable timeout settings and real-time testing capabilities.,https://github.com/dseeker,2/16/2025,https://github.com/EndemicMedia,,,
,Tool,Untested,toolsInterfaces,Pollinations Feed,https://elixpoart.vercel.app/src/feed,"Builds a bentro grid UI which integrates with the pollinations realtime SSE feed to show case art generation, with virtual DOM update to reduce lag and optimization.",Ayushman Bhattacharya,3/14/2025,https://github.com/Circuit-Overtime/elixpo_ai_chapter,,,
,Tool,Untested,toolsInterfaces,toai.chat,https://toai.chat,"An AI chat service that operates exclusively via Curl commands, specifically designed for users working in terminal environments without the need for a standalone AI client.",kevin@kevin1986.com,3/27/2025,https://github.com/Veallym0n/toai.chat,,,
,Tool,Untested,toolsInterfaces,DominiSigns,,"Avatar Translator for Dominican Sign Language that uses artificial intelligence to translate text and audio into Dominican sign language (LSRD), creating a communication bridge for approximately 100,000 deaf people in the Dominican Republic.",@cmunozdev,4/6/2025,https://github.com/cmunozdev/DominiSigns,,,
,Discord,3 Stars,socialBots,Titan-GPT,https://t.me/titangpt_channel,Free Telegram bot providing access to neural networks including image and text generation powered by Pollinations.AI,t.me/titangpt_support,,,TRUE,,
,Web,3 Stars,socialBots,Telegram Bot,http://t.me/pollinationsbot,A Telegram bot for generating images based on user prompts.,Wong Wei Hao,,,TRUE,,
,iOS,3 Stars,socialBots,WhatsApp Group,https://chat.whatsapp.com/KI37JqT5aYdL9WBYMyyjDV,A WhatsApp group for image generation.,@dg_karma,,,TRUE,,
,Web,3 Stars,socialBots,🤖 pollinations-tg-bot 🇨🇳,https://t.me/AipolBot,"A Telegram bot deployed on Cloudflare Workers that allows users to generate images, convert text to speech, transcribe voice messages, chat with AI models, and more through the Pollinations API.",@Shadownc,3/27/2025,https://github.com/Shadownc/pollinations-tg-bot,TRUE,zh-CN,
,Web,2 Stars,socialBots,AlphaLLM - AI Discord Bot,https://alphallm.fr.nf,"Discord bot that uses several APIs (Pollinations AI and Cerebras AI), to offer a variety of features, including advanced text generation with a history of your conversations, image and voice generation.",@the_yerminator,3/31/2025,https://github.com/YoannDev90/AlphaLLM,,,
,Web,2 Stars,socialBots,🆕 🤖 Raftar.xyz,https://raftar.xyz,"A Discord multi-purpose bot with over 100+ commands, including AI image generation, ChatGPT, and SearchGPT powered by Pollinations.AI.",@goodgamerhere,4/15/2025,,,,
,Web,1 Star,socialBots,Anyai,https://discord.gg/anyai,A Discord bot and community for AI-driven content.,@meow_18838,,,,,
,Android,Untested,socialBots,OpenHive,https://discord.gg/Zv3SXTF5xy,"A Discord server bridging Discord and AI, featuring Beebot.",@creativegpt,,,,,
,Web,Buggy,socialBots,One Word,https://t.me/OdnoSlovoBot,"A Telegram bot for a word-matching game where players try to write the same word simultaneously, featuring image generation from game words using Pollinations.AI.",@Dimaq21,2/17/2025,,,,
image not appearing,Web,Buggy,socialBots,Gacha,https://shapes.inc/gacha-gachu/public,"A versatile AI chat-bot and image generator powered by Pollinations.AI, featuring web search, image generation with model selection, and character-aware image generation through !webgen command.",@_dr_misterio_,2/24/2025,,,,
no link,,Untested,socialBots,Jackey,https://discord.com/oauth2/authorize?client_id=1214916249222643752,"A Discord Bot that integrates with the pollination image generation api to generate images in various themes, numbers, ratios and models",@elixpo.asm,3/15/2025,,,,
,Discord,3 Stars,sdkLibraries,@pollinations/react,https://www.npmjs.com/package/@pollinations/react,React hooks for easy integration of Pollinations' features.,@pollinations,,,TRUE,,
,WhatsApp,3 Stars,sdkLibraries,pollinations.ai Python SDK,https://github.com/pollinations-ai/pollinations.ai,Official Python SDK for working with Pollinations' models.,@pollinations-ai,,,TRUE,,
,Web,3 Stars,sdkLibraries,MCPollinations,https://github.com/pinkpixel-dev/MCPollinations,"A Model Context Protocol (MCP) server that enables AI assistants to generate images, text, and audio through the Pollinations APIs. Supports customizable parameters, image saving, and multiple model options.",Pink Pixel,4/13/2025,https://github.com/pinkpixel-dev/MCPollinations,TRUE,,
,Web,3 Stars,sdkLibraries,🆕 Smpldev,https://smpldev.ftp.sh/,"Create, deploy, and scale full-stack web and mobile applications in minutes.",@kennet678,4/15/2025,,TRUE,,
